{
  "schema_version": "0.1",
  "product_id": "silverback-agent",
  "run_id": "run_20251223_043329",
  "started_at": "2025-12-23T04:33:29.179852+00:00",
  "ended_at": "2025-12-23T04:33:33.199223+00:00",
  "status": "success",
  "summary": "All tests passed",
  "evidence": {
    "paths": [
      "runs/silverback-agent/run_20251223_043329/pytest_output.log"
    ]
  },
  "banana_economy": {
    "budget_tokens": 50000,
    "spent_tokens": 0,
    "budget_minutes": 90,
    "spent_minutes": 0.07,
    "max_ci_heal_attempts": 2,
    "ci_heal_attempts_used": 0
  },
  "kill_switch": {
    "enabled": false,
    "reason": ""
  },
  "pr_wave": {
    "state": "none",
    "open_prs": 0,
    "last_update": "2025-12-23T04:33:33.199223+00:00"
  }
}